{
  "alert_id": "e3f4a5b6-c7d8-4e9f-0a1b-2c3d4e5f6a7b",
  "alert_schema_version": "1.0",
  "alert_type": "CREDENTIAL_STUFFING_CAMPAIGN",
  "title": "Coordinated Multi-Account Credential Stuffing Campaign",
  "summary": "Distributed credential stuffing pattern identified across 8 distinct username fingerprints using automated pacing.",
  "detection_rule_id": "RULE-AUTH-005",
  "detection_rule_version": "2.0.0",
  "detection_category": "CREDENTIAL_STUFFING",
  "detection_explanation": "Correlation engine detected low-and-slow authentication failures targeting distinct corporate username fingerprints from identical source subnet.",
  "severity": "CRITICAL",
  "confidence": 96,
  "assessment_status": "ESCALATED",
  "evidence_strength": "DEFINITIVE",
  "observed_source_id": "src_profile_9876543210ab",
  "source_address": "198.51.100.45",
  "decoy_id": "WEB-001",
  "target_service": "WEB_PORTAL",
  "first_observed_at": "2026-10-31T10:10:00.000000+00:00",
  "last_observed_at": "2026-10-31T10:25:00.000000+00:00",
  "generated_at": "2026-10-31T10:25:05.500000+00:00",
  "updated_at": "2026-10-31T10:26:00.000000+00:00",
  "session_ids": [
    "decoy_sess_3430c5e63810486c99cff33faad6a50d",
    "decoy_sess_7890abcdef1234567890abcdef123456"
  ],
  "related_event_ids": [
    "f6a1b2c3-d4e5-4f6a-bf7b-8c9d0e1f2a3b",
    "b2c3d4e5-f6a1-4b2c-9d3e-4f5a6b7c8d9e",
    "a7b8c9d0-e1f2-4a7b-8c9d-0e1f2a3b4c5d"
  ],
  "related_alert_ids": [
    "c1d2e3f4-a5b6-4c7d-8e9f-0a1b2c3d4e5f",
    "d2e3f4a5-b6c7-4d8e-9f0a-1b2c3d4e5f6a"
  ],
  "attack_chain_id": "f4a5b6c7-d8e9-4f0a-1b2c-3d4e5f6a7b8c",
  "evidence": {
    "summary": "Correlation of 42 authentication failures across 8 unique HMAC username hashes spanning 2 persistent sessions",
    "supporting_count": 42,
    "triggering_conditions": {
      "unique_username_fingerprints": 8,
      "correlation_time_span_minutes": 15,
      "correlated_alert_count": 2
    },
    "evidence_references": [
      "f6a1b2c3-d4e5-4f6a-bf7b-8c9d0e1f2a3b",
      "b2c3d4e5-f6a1-4b2c-9d3e-4f5a6b7c8d9e",
      "a7b8c9d0-e1f2-4a7b-8c9d-0e1f2a3b4c5d"
    ]
  },
  "mitre_attack": {
    "framework_version": "v14.1",
    "tactic_id": "TA0006",
    "tactic_name": "Credential Access",
    "technique_id": "T1110.004",
    "technique_name": "Credential Stuffing",
    "mapping_confidence": 98,
    "mapping_evidence": "Sequential automated login attempts testing known credentials across multiple employee usernames."
  },
  "analyst_workflow": {
    "assigned_analyst_id": "analyst_secops_04",
    "investigation_id": "01234567-89ab-4cde-f012-3456789abcde",
    "analyst_notes_reference": "ref:notes_case_stuffing_1031"
  },
  "recommendations": {
    "recommended_action": "Execute immediate defensive isolation: block CIDR 198.51.100.0/24 at perimeter and verify production identity logs for compromised accounts matching observed fingerprints.",
    "recommendation_reason": "Sustained credential stuffing pattern indicates adversary utilizing compromised credential dumps.",
    "response_approval_required": true
  }
}
